{
  "format": "psalms_karaoke_json_v1",
  "granularity": "syllable",
  "job_id": "fixture",
  "lines": [
    {
      "start": 0.0,
      "end": 2.0,
      "text": "Hello world",
      "chunks": [
        { "start": 0.0, "end": 1.0, "text": "Hello ", "char_start": 0, "char_end": 6 },
        { "start": 1.0, "end": 2.0, "text": "world", "char_start": 6, "char_end": 11 }
      ]
    }
  ]
}

